{
  "schemaVersion": 1,
  "id": "tga-sedating-antihistamines-children-2022",
  "type": "regulator",
  "title": "First-generation antihistamines - winter warning",
  "authorsOrOrganisation": ["Therapeutic Goods Administration"],
  "publication": "Therapeutic Goods Administration safety alert",
  "publishedAt": "2022-07-13",
  "updatedAt": null,
  "doi": null,
  "url": "https://www.tga.gov.au/safety/safety-monitoring-and-information/safety-alerts/first-generation-antihistamines-winter-warning",
  "accessedAt": "2026-07-15",
  "jurisdiction": "AU",
  "language": "en-AU",
  "peerReviewed": false,
  "retractedOrCorrected": false,
  "notes": "Regulator warning says not to use first-generation antihistamines for cough, cold and flu symptoms in children under 6, and not to give them to children under 2 for any indication. Product labels and current professional advice remain necessary."
}
