{
  "schemaVersion": 1,
  "id": "healthdirect-nsaids-2024",
  "type": "guideline",
  "title": "Anti-inflammatory medicines (NSAIDs)",
  "authorsOrOrganisation": ["Healthdirect Australia"],
  "publication": "Healthdirect",
  "publishedAt": null,
  "updatedAt": "2024-06-01",
  "doi": null,
  "url": "https://www.healthdirect.gov.au/anti-inflammatory-medicines",
  "accessedAt": "2026-07-15",
  "jurisdiction": "AU",
  "language": "en-AU",
  "peerReviewed": false,
  "retractedOrCorrected": false,
  "notes": "Australian consumer guidance last reviewed June 2024. Retained for duplicate-ingredient and cardiovascular-medicine interaction boundaries. It is not used to recommend an NSAID."
}
