{
  "schemaVersion": 1,
  "id": "healthdirect-medicines-breastfeeding-2025",
  "type": "guideline",
  "title": "Medicines and breastfeeding",
  "authorsOrOrganisation": ["Healthdirect Australia"],
  "publication": "Healthdirect",
  "publishedAt": null,
  "updatedAt": "2025-08-01",
  "doi": null,
  "url": "https://www.healthdirect.gov.au/medicines-and-breastfeeding",
  "accessedAt": "2026-07-15",
  "jurisdiction": "AU",
  "language": "en-AU",
  "peerReviewed": false,
  "retractedOrCorrected": false,
  "notes": "Australian consumer guidance last reviewed August 2025. Retained for general lactation medicine-safety boundaries. Ingredient-level statements remain excluded from canonical content pending current clinical review."
}
