{
  "schemaVersion": 1,
  "id": "australian-immunisation-handbook-immunocompromised-contacts-2026",
  "type": "guideline",
  "title": "Close contacts of people who are immunocompromised",
  "authorsOrOrganisation": ["Australian Technical Advisory Group on Immunisation", "Australian Government Department of Health, Disability and Ageing"],
  "publication": "Australian Immunisation Handbook",
  "publishedAt": null,
  "updatedAt": "2026-03-13",
  "doi": null,
  "url": "https://immunisationhandbook.health.gov.au/contents/vaccination-for-special-risk-groups/vaccination-for-people-who-are-immunocompromised/close-contacts-of-people-who-are-immunocompromised",
  "accessedAt": "2026-07-15",
  "jurisdiction": "AU",
  "language": "en-AU",
  "peerReviewed": false,
  "retractedOrCorrected": false,
  "notes": "Official Australian guidance last reviewed 13 March 2026. Retained for the principle of indirect protection through up-to-date routine vaccination of close contacts. Live-vaccine details are excluded from reader claims pending specialist review."
}
