{
  "schemaVersion": 1,
  "id": "heart-foundation-respiratory-infections-cardiovascular-2026",
  "type": "guideline",
  "title": "Respiratory infections, vaccinations and your heart",
  "authorsOrOrganisation": ["National Heart Foundation of Australia"],
  "publication": "Heart Foundation",
  "publishedAt": null,
  "updatedAt": "2026-04-14",
  "doi": null,
  "url": "https://www.heartfoundation.org.au/your-heart/vaccinations-and-infections",
  "accessedAt": "2026-07-15",
  "jurisdiction": "AU",
  "language": "en-AU",
  "peerReviewed": false,
  "retractedOrCorrected": false,
  "notes": "Australian cardiovascular consumer guidance updated 14 April 2026. Retained for infection-risk orientation, vaccination, fluid-plan and cold-medicine interaction boundaries. Numerical benefit and risk claims require source-level evidence verification before canonical use."
}
