{
  "schemaVersion": 1,
  "id": "mothersafe-common-cold-pregnancy-breastfeeding-2023",
  "type": "guideline",
  "title": "The common cold in pregnancy and breastfeeding",
  "authorsOrOrganisation": ["MotherSafe", "Royal Hospital for Women", "South Eastern Sydney Local Health District"],
  "publication": "MotherSafe factsheet",
  "publishedAt": "2023-07-12",
  "updatedAt": null,
  "doi": null,
  "url": "https://www.seslhd.health.nsw.gov.au/sites/default/files/groups/Royal_Hospital_for_Women/Mothersafe/documents/Cold%20in%20Pregnancy%20and%20breastfeeding%20July12%202023.pdf",
  "accessedAt": "2026-07-15",
  "jurisdiction": "AU",
  "language": "en-AU",
  "peerReviewed": false,
  "retractedOrCorrected": false,
  "notes": "Current July 2023 MotherSafe factsheet located through the Royal Hospital for Women. Older 2008 and 2010 versions are excluded. Ingredient-specific advice requires independent clinical currency review before canonical use."
}
